The Russians Did Not ‘Hack The Election.’ Repeat. The Russians Did Not ‘Hack The Election’: There's… https://t.co/jRYGP4d64U | #Election2016
"In the weekly address, @SenWarren joins President Obama to discuss economic progress and Wall Street reform. https://t.co/u441ol4m3B"
"Anna Wintour came to my office at Trump Tower to ask me to meet with the editors of Conde Nast &amp; Steven Newhouse, a friend. Will go this AM."
Say you support decisive action to tackle climate change. https://t.co/S9gkxn0wpv #ActOnClimate
Democrats preview line of attack on 'pro-corporate' high court nominee https://t.co/FnDQplugkz https://t.co/ViCd3DnQ0H
RT @FSIStanford: FSI's @StonerWeiss discusses the FBI's investigation into Russian interference in #election2016. https://t.co/SRHfuZWeYP @…
"Cinco de Mayo carnival cancelled amid immigration crackdown fears  | By @eshugerman 
",https://t.co/DeuKUU4T3L
Gorsuch faces questions in Supreme Court hearing's second day: Watch live | Fox News https://t.co/L3ER5zqx4d
Tens of millions of Americans have benefited from #Obamacare. Make sure you're one of them. #GetCovered https://t.co/e1KoXcPtpU
White House tax reform may begin in late spring: Spicer https://t.co/hg4S5HTDHL https://t.co/KBzWfnudZI
Chelsea Blais: 5 Fast Facts You Need to Know https://t.co/0ylaGZI0sY #election2016 https://t.co/rVRDXlBK70
"Today, we remember the crew of the Space Shuttle Challenger, 31 years later. #NeverForget https://t.co/OhshQsFRfl"
"Nationwide, editorial boards agree that Senate leaders should get to work and hold a fair hearing for Judge Garland. https://t.co/y7tYvcyILv"
Trump working with Republican leaders on healthcare plan changes: spokesman https://t.co/o46Bqiu6Cf https://t.co/WCRsxdqsrL
No wonder the Today Show on biased @NBC is doing so badly compared to its glorious past. Little credibility!
"Mexico has taken advantage of the U.S. for long enough. Massive trade deficits &amp; little help on the very weak border must change, NOW!"
Don't get tripped up by misinformation. Join the @OFA Truth Team today: https://t.co/wJZj1QCxXm https://t.co/vwwDgFHq6A
White House working with lawmakers on amending Republican health bill https://t.co/0JytLbH0nI https://t.co/VIjQCwGTRq
"RT @1MeLrO: Nothing as relaxing as hopping on twitter and seeing people arguing about politics 
","
",Yes this is sarcasm
RT @peterdaou: 1. THREAD. Why Hillary hate is at the core of the current crisis in US politics. You can't understand Trump if you don't get…
"RT @RVAwonk: Sen. Al Franken is using the words of Bannon, Priebus, &amp; others to undermine the idea that Gorsuch 'stays out of politics'. #G…"
RT @lacasablanca: La típica Latina tarda 22 meses en ganar lo que un hombre blanco gana en 12 meses. Tenemos que cerrar la brecha salarial.…
RT @RealJamesWoods: #Yawn Hillary Clinton will never be president. EVER... https://t.co/IuphkAl5Cy
Republican Obamacare repeal would benefit wealthiest: study https://t.co/PA3Jq7LEZ3 https://t.co/7BGJ9h00VO
The Russians Did Not ‘Hack The Election.’ Repeat. The Russians Did Not ‘Hack The Election’: There's… https://t.co/Mj0gTu4F4d | #Election2016
"RT @Politolizer: Senator Al Franken questions Gorsuch's judgement, saying his decision is 'absurd' https://t.co/kw1IMyHSoM https://t.co/Zcv…"
Pro-Brexit ministers 'relaxed about leaving EU without trade deal' https://t.co/2vYUopVl5w
The Russians Did Not ‘Hack The Election.’ Repeat. The Russians Did Not ‘Hack The Election’: There's… https://t.co/FnODUGRqrI | #Election2016
"RT @WhiteHouse: At 1:30pm ET, @POTUS will deliver a statement on the tragic shooting in #Orlando. Watch live: https://t.co/k6QWAbrHAh"
".@NBCNews purposely left out this part of my nuclear qoute: ""until such time as the world comes to its senses regarding nukes.""  Dishonest!"
Today marks 125 days since Judge Garland's nomination—the longest time in history from nomination to confirmation. https://t.co/9qff6NdrmR
RT @mtaibbi: Taibbi: Trump SEC Pick Jay Clayton Connected to Mysterious Firm - Rolling Stone https://t.co/LjGaJkBmip
clinton flavored vape ##election2016
RT @ladygaga: Listen up America ✌🏾✌🏿✌🏽✌🏼✌🏻Get in your car or put on your shoes + go out &amp; #Vote ! 🇺🇸 needs you!! #ElectionDay #Election2016…
"I don't know Putin, have no deals in Russia, and the haters are going crazy - yet Obama can make a deal with Iran, #1 in terror, no problem!"
I'm just curious how far @FoxNews @FoxAndFriends will go to shill for #Trump. Thus far following #Election2016 I'm seeing no limit. #FoxNews
"Special Report: Russian elite invested nearly $100 million in Trump buildings, records show https://t.co/bChlW98bMV https://t.co/oUmQAi2sNn"
Senate intelligence committee leaders: no wiretap of Trump Tower https://t.co/FtW3ddqy2o https://t.co/JgglzXrdVG
Watch President Obama deliver remarks at the #DallasMemorial service yesterday. https://t.co/BHIQTdnIDr
"""Bayer AG has pledged to add U.S. jobs and investments after meeting with President-elect Donald Trump, the latest in a string..."" @WSJ"
U.S. Supreme Court’s ideological balance at stake in confirmation fight https://t.co/7nBvfBdEGL https://t.co/bZaAoenbkB
RT @civilrightsorg: Neil Gorsuch’s record on money in politics suggests that he’ll side with big money over ordinary voters. No thanks to t…
JUST IN: White House says Secretary of State Tillerson sent clear signal to North Korea that U.S. policy of strategic patience is over
The Russians Did Not ‘Hack The Election.’ Repeat. The Russians Did Not ‘Hack The Election’: There's… https://t.co/d8ppHS05LP | #Election2016
Body of former IRA commander Martin McGuinness carried through streets of Derry in front of huge…… https://t.co/W9ld1xNuBV
Thank you to Ford for scrapping a new plant in Mexico and creating 700 new jobs in the U.S. This is just the beginning - much more to follow
"RT @WhiteHouse: ""We stand united with the people and the police department in Dallas."" —@POTUS on last night's attack in #Dallas: https://t…"
How U.S. healthcare stacks up under Obamacare and the new Republican plan AHCA: https://t.co/Pn4rCgDlkV via… https://t.co/tCJxZYuxCa
Minister told to remind Germany of cancelled WW2 debt amid EU demand for £50bn Brexit fee | Politics | News |  https://t.co/ExwWCNmvzl
RT @NBCNews: These Republicans could doom their party's health care bill https://t.co/Sxo8byZuxS https://t.co/qeYYnbLTKI
I promise that our administration will ALWAYS have your back. We will ALWAYS be with you! https://t.co/D0aOWhOH4X
"We can do more than thoughts, prayers, and moments of silence. Add your voice to call on Congress to #DisarmHate. https://t.co/6CiFxUwwD7"
@RepJimRenacci @1590WAKRNews @realDonaldTrump Vote No. take a stand for human decency not Party politics. Yes vote will mean defeat in re-el
"Jeff Sessions is an honest man. He did not say anything wrong. He could have stated his response more accurately, but it was clearly not...."
House intelligence panel chairman says there was no wiretap on Trump Tower https://t.co/PiLTHJiMGY https://t.co/VXJurWuZG1
RT @Ye_Binnie: When our generation enter politics I hope you prepared for all the old saved screenshots and voicenotes. These ppl grimy
I have made my decision on who I will nominate for The United States Supreme Court. It will be announced live on Tuesday at 8:00 P.M. (W.H.)
Quick—you're running out of time to chip in before the fundraising deadline. https://t.co/1c3ejYu2WB https://t.co/JM9WbRIBFZ
"Meeting w/ Washington, D.C. @MayorBowser and Metro GM Paul Wiedefeld about incoming winter storm preparations here… https://t.co/mg0A4Hq3bD"
Don't pass this up—enter now: https://t.co/aIOZd4OfIH https://t.co/OgOyee6i4i
"Ungrateful TRAITOR Chelsea Manning, who should never have been released from prison, is now calling President Obama a weak leader. Terrible!"
RT @jcw14all: Petulant DemMedia still in absolute denial re why they lost #Election2016: dem-media collusion in the politics of uber Hypocr…
"RT @paulkrugman: Not the most important thing, but applying this ban only to foreign-owned airlines clear violation of trade rules https://…"
Justin Trudeau's family trip to the Bahamas cost more than $127K https://t.co/06CWvtWwMc #cdnpoli #LPC
"Trump's net worth dwindled to $3.5 billion, Forbes says https://t.co/9cMpaibX0d"
"Lawmakers seek FBI, NSA answers on Trump, Russia at rare public hearing https://t.co/a1e2JCQ0dU https://t.co/S5MgzeNZfC"
"LIVE: House Intelligence Committee conducts hearing on alleged Russian meddling in election, FBI's Comey to testify… https://t.co/LU4pVErEsm"
How first daughter Ivanka Trump's role at the White House has grown https://t.co/QZk9KLZurv #election2016 https://t.co/3HZbZI5Kqb
"@MaxineWaters your and idiot, how the hell are you in any position in politics?  Fucking mental idiot"
Tillerson says State Department spending 'simply not sustainable' https://t.co/FssPLMfI86
"Minister told to remind Germany of cancelled World War 2 debt amid EU demand for £50bn Brexit fee 
",https://t.co/i7ro54AnF2 #Brexit
Republicans defend healthcare plan after report says 14 million Americans would lose medical insurance by next year… https://t.co/26NbJ1RJMG
"When Americans stand together, there's no challenge too great to solve—not even climate change. #ActOnClimate today: https://t.co/5mqlv3ZXas"
Treasury's Mnuchin says Trump does not want trade wars https://t.co/S9tyIGbeGO https://t.co/gjG1vnHakL
.@realDonaldTrump: Work with Congress to fully repeal the defense sequester and submit a new https://t.co/8Cx28JXdRb #Election2016
"RT @WhiteHouse: FACT: Since @POTUS took office more than 50,000 workers have been trained to enter the solar industry #ActOnClimate https:/…"
Trump puts extra skinny into his 'skinny budget' https://t.co/GomGIEv0A3
RT @SportMediaPsych: Take this quick survey https://t.co/vKTVP5qZIw #Election2016 #GOP #Democrats
"RT @BraddJaffy: Dave Brat tells @KatyTurNBC he doesn't think there are enough GOP votes to hold AHCA vote on Thurs.
","
",NBC News count: https:…
Supreme Court reins in president's appointment powers https://t.co/uK8Yy3rR02
"Everything Apple just announced: Cheaper iPad, red iPhone - CNET https://t.co/6KK6LkHuhv #election2016 https://t.co/4WXqXxtbfP"
New standards for heavy-duty trucks will cut 1.1 billion metric tons of carbon pollution through 2027. https://t.co/1BncKu28M3
Trump administration fights its own agency in U.S. court https://t.co/mFotlimjN3
New report: Renewable energy installations are beating fossil fuel installations for the first time. https://t.co/MMhIdu4jzt #ActOnClimate
RT @FSIStanford: FSI's @StonerWeiss discusses the FBI's investigation into Russian interference in #election2016. https://t.co/SRHfuZWeYP @…
Big interview tonight by Henry Kravis at The Business Council of Washington. Looking forward to it!
"Happy Valentine’s Day, @michelleobama! Almost 28 years with you, but it always feels new. https://t.co/O0UhJWoqGN"
The Russians Did Not ‘Hack The Election.’ Repeat. The Russians Did Not ‘Hack The Election’: There's… https://t.co/sEbnjeTOts | #Election2016
"RT @cspan: .@RepJohnLewis on #GunViolence: ""The time for silence is over."" https://t.co/zUUX02jNnN"
RT @RepAnthonyBrown: I will be meeting with President Trump tomorrow with @OfficialCBC leadership. We have much to discuss https://t.co/yNn…
Senate leaders are blocking the Supreme Court nomination for their own political gain—don't be silent: https://t.co/OMdTVim0TC #DoYourJob
NK propaganda video shows US jet ablaze - North Korean government website Uriminzokkiri released a propaganda v... https://t.co/578sVDxrTb
"RT @oreillyfactor: SCOTUS nominee Gorsuch acquitted himself well in the Senate today. He's man who will rule on law, not politics. More on…"
U.S. reverses course and offers new dates for NATO talks https://t.co/5T4PofmROY
"We've come a long way, but there's still more to do to make sure women are truly treated equally. #WomensEqualityDay https://t.co/B7C0Nk27T5"
FBI and NSA chiefs will testify on Trump wiretap claims in March 20 hearing: lawmakers. https://t.co/bHny3hymWq https://t.co/0cqTuBaNVq
WATCH LIVE: House Speaker Paul Ryan holds a news conference. https://t.co/jovgYMpNJN
It’s President Obama’s last birthday in office—​d​on’t forget to sign ​the card. https://t.co/CLi4FB4WKp
"RT @oreillyfactor: SCOTUS nominee Gorsuch acquitted himself well in the Senate today. He's man who will rule on law, not politics. More on…"
Petulant DemMedia still in absolute denial re why they lost #Election2016: dem-media collusion in the politics of uber HypocriticalHysteria
"Six years later, and Republican leaders still have no credible #Obamacare alternative. https://t.co/Y6yMqo4bEe"
.@HillaryClinton: Create a $25 billion national infrastructure bank https://t.co/7Y8d7HQFuB #Election2016
find the leakers within the FBI itself. Classified information is being given to media that could have a devastating effect on U.S. FIND NOW
It has been a record-breaking 139 days since Judge Garland was nominated and still no hearing or vote. #DoYourJob https://t.co/IX6RxQ300I
GOP Sen. Jeff Flake: Trump should apologize for wiretapping claim - https://t.co/t1it6wQ4zj #SmartNews https://t.co/8hKwdxZJSG
WATCH: Merkel says she and Trump discussed Afghanistan and continuing the mission there with the U.S. https://t.co/9UpVshK0E3
The Supreme Court shouldn't be part of partisan political games. Add your name if you agree: https://t.co/j8T9Vqlffe
South Dakota's governor vetoes loosening of concealed carry gun laws https://t.co/OKxqF72b2p
WWE Paige Update: No Discipline Expected After Photo Leak https://t.co/26dBnaUiAb #election2016 https://t.co/Rblqh7bphD
"RT @TheEllenShow: Just seeing the news about removing laws protecting trans people. This isn’t about politics. It’s about human rights, and…"
"RT @asmith83: Trump, last night in Louisville: ""We believe in two simple rules: Buy American and hire American."" https://t.co/67iOgUyEAt ht…"
"""@FoxNews: ""We certainly don’t want intelligence interfering with politics and we don’t want politics interfe… https://t.co/bwDjEg1d7S"""
Democrats preview line of attack on 'pro-corporate' high court nominee https://t.co/8DnISCaVpf
"The FBI is totally unable to stop the national security ""leakers"" that have permeated our government for a long time. They can't even......"
Our children's health and prosperity is too important to ignore the consequences of climate change. Speak out now: https://t.co/sDgDkRxb6W
"Zehnder"". If democracy to judge bantam hens at the American politics ran around in New Deal Consensus was constructed in"
Dramatic footage shows police officer haul terrified teenager from frozen lake https://t.co/DKsTl3bLi0 #election2016 https://t.co/Yo4rhtnvQr
"FAKE NEWS media, which makes up stories and ""sources,"" is far more effective than the discredited Democrats - but they are fading fast!"
LIVE: House Intelligence Committee members hold news conference on Russia investigation. https://t.co/9Gos7N6iOA
"U.S. Secretary of State to visit Turkey on March 30, says Turkish minister https://t.co/VEYBlZ9Z8U https://t.co/cqNZ8kY2rz"
RT @ABC: Ivanka Trump's role heading into unprecedented territory after it's announced she'll have a West Wing office. https://t.co/a54P0ZT…
"When a country is no longer able to say who can, and who cannot , come in &amp; out, especially for reasons of safety &amp;.security - big trouble!"
Why thousands of elderly women are called 'witches' before being burned alive or knifed to death in…… https://t.co/ErUuog3aqd
"John Lewis said about my inauguration, ""It will be the first one that I've missed."" WRONG (or lie)! He boycotted Bush 43 also because he..."
Trump picks Boeing executive Shanahan to become Pentagon's No.2 https://t.co/Gp1yXnEdtP
Enjoy the #SuperBowl and then we continue: MAKE AMERICA GREAT AGAIN!
"Meeting with biggest business leaders this morning. Good jobs are coming back to U.S., health care and tax bills are being crafted NOW!"
"RT @KamalaHarris: I’ve joined my colleagues to introduce a bill that would rescind Trump’s order to construct the border wall. 
",https://t.c…
"RT @guardian: Identity politics and intolerance are a barrier to development, says UN report https://t.co/Mbr3EOqP5e"
Missing from Trump's grand Navy plan: skilled workers to build the fleet https://t.co/u5dDoMgynm
The Russians Did Not ‘Hack The Election.’ Repeat. The Russians Did Not ‘Hack The Election’: There's… https://t.co/tBe9fPo6j1 | #Election2016
Who is Neil Gorsuch? via the @FoxNews App https://t.co/3lSKZsldmA
"Our economy is on a better, stronger course. https://t.co/yzB6x7CExJ"
RT @_RadiantVibes: #Election2016   Makes me feel like I'm taking CraZY PiLLZ! https://t.co/cSTmJGB9U8
The Russians Did Not ‘Hack The Election.’ Repeat. The Russians Did Not ‘Hack The Election’: There's… https://t.co/w7SELhignF | #Election2016
"U.S. restricts carry-on electronic devices on planes coming from 10 airports, mainly in Middle East:… https://t.co/nVpzicjawX"
"RT @PeteButtigieg: 'If more politicians knew poetry, and more poets knew politics... the world would be a little better place.' - JFK #Worl…"
LIVE: Comey and Rogers on new tweets from @POTUS https://t.co/ZOOSt44tKm https://t.co/jfw7ZYfb1l
James Clapper and others stated that there is no evidence Potus colluded with Russia. This story is FAKE NEWS and everyone knows it!
RT @IrishTimes: Ireland knew two Martin McGuinnesses: the man of war and the man of peace  #MartinMcGuinness https://t.co/pjFwebQop3
RT @ianbirrell: This attack on the BBC #Brexit coverage is same style of politics as seen with Trump: a shrill attempt to silence criticism…
Trump's proposal to scrap Chemical Safety Board draws criticism https://t.co/0uj5yr8g3F https://t.co/JW04wc73wp
Trump to drop climate change from environmental reviews: Bloomberg https://t.co/1Ld1QLOZ7K https://t.co/RQG63qZohF
Congratulations Secretary Mattis! https://t.co/mkuhbegzqS
Trump does not agree with lawmaker's immigration tweet: White House https://t.co/Fpu0D4B5X5 https://t.co/9KQMbHMhfx
A budget that puts #AmericaFirst must make safety its no. 1 priority—without safety there can be no prosperity: https://t.co/9lxx1iQo7m
"RT @CNN: Trump warns on health care: ""I honestly think many of you will lose your seats in 2018 if you don't get this done"" https://t.co/F2…"
See our running timeline on President Trump's #first100days: https://t.co/Hzn8ghIwXE https://t.co/kjTQCg1xOr
Join the thousands of people calling on Congress to do something about gun violence—add your name: https://t.co/M0QQvNiYdj #WearOrange
Thank you for the great rallies all across the country. Tremendous support. Make America Great Again!
"...do the typical political thing and BLAME. The fact is ObamaCare was a lie from the beginning.""Keep you doctor, keep your plan!"" It is...."
The Russians Did Not ‘Hack The Election.’ Repeat. The Russians Did Not ‘Hack The Election’: There's… https://t.co/aD20gftTIy | #Election2016
"Tonight, President Obama reflects on eight years of progress. Watch the #FarewellAddress at 9 pm ET: https://t.co/ZnwTsg155B #ObamaFarewell"
How low has President Obama gone to tapp my phones during the very sacred election process. This is Nixon/Watergate. Bad (or sick) guy!
".@HillaryClinton: Ensure benefits are flexible, portable, and comprehensive, as the economy https://t.co/TlPlJl2IHQ #Election2016"
WATCH: Merkel says she hopes U.S. and EU can resume trade agreement discussions. https://t.co/SCxppM32MZ
We must fix our education system for our kids to Make America Great Again. Wonderful day at Saint Andrew in Orlando. https://t.co/OTJaHcvLzf
@maziehirono Every citizen cares of too much $$ in politics.  Ask Your OWN PARTY re:contributions of Donald Soros (gives multi$$ to Ur PARTY
RT @FSIStanford: FSI's @StonerWeiss discusses the FBI's investigation into Russian interference in #election2016. https://t.co/SRHfuZWeYP @…
"RT @Independent: Donald Trump is recording morning TV shows to watch before bed, say White House sources https://t.co/qiDrmqsnza"
"Thank you Louisville, Kentucky- on my way! #MAGA🇺🇸 https://t.co/3QsBsib6kt"
"RT @cnnbrk: Supreme Court nominee Neil Gorsuch says attacks on judges from President Trump and others are ""demoralizing."" https://t.co/Lxk4…"
Another record broken. https://t.co/sw9XGUXWqX #ActOnClimate
"RT @Arctic__char: Comey logic...
","
",#Election2016 https://t.co/Mi1bLnvCXT
Today's #SCOTUS ruling reaffirms that every woman has a right to make her own reproductive choices. https://t.co/uvgc9MgX3e
Conservative news site sole media outlet on Tillerson Asia trip https://t.co/IzzQeYpVNb
Highlights: The Trump presidency on March 19 at 6:50 p.m. EDT https://t.co/YYUn4yh5DZ https://t.co/235gNzEDM6
RT @CNN: Official: Recent intel found that an al Qaeda affiliate was perfecting techniques for hiding explosives in batteries https://t.co/…
"life sucks and then you die, so vote ##election2016"
"In the meantime, I want to hear what you're thinking about the road ahead. So share your ideas with me here: https://t.co/GYkEOK8EuT"
I have to ADMIT Secretary Clinton is very much so a generous and diligent leader. Who are you voting for? #election2016 #hillaryclinton
The Russians Did Not ‘Hack The Election.’ Repeat. The Russians Did Not ‘Hack The Election’: There's… https://t.co/cu5J23VGjr | #Election2016
Chicago Facebook Live Video Gang Rape: 5 Fast Facts You Need to Know https://t.co/Dvh3FChuMK #election2016 https://t.co/nMcCFvBKcg
RT @FSIStanford: FSI's @StonerWeiss discusses the FBI's investigation into Russian interference in #election2016. https://t.co/SRHfuZWeYP @…
Tillerson to face Chinese ire over blame for North Korea tensions https://t.co/8sbrVx8QaP
Supreme Court balks at reining in 'racial gerrymandering' that protects black lawmakers https://t.co/W5sshFpbo0
"RT @Cernovich: Spring breakers chant 'Build that wall!' during Cancun cruise
","
",https://t.co/7HVSrRFH1I
"The economy added 151,000 jobs in August—extending the longest streak of total job growth on record."
WATCH: President Trump knocks NFL's Colin Kaepernick during Kentucky speech https://t.co/He4G5g7Ac0 #election2016 https://t.co/qaiwKARLwG
"The DJT Foundation, unlike most foundations, never paid fees, rent, salaries or any expenses. 100% of money goes to wonderful charities!"
We’re taking important steps to help guarantee the basic security of paid family leave. https://t.co/yvRhINmIGA #LeadOnLeave
"#BenSasse, who spilled his #Evagelical EMO all over #Election2016 sez it's wrong to look at #Grosuch's heart...cuz, y'know, HE'S impartial."
Speak out against gun violence—#WearOrange tomorrow. https://t.co/IUguOJg2Zk
RT @LeahR77: List Of Prominent Dems Who Voted For Neil #Gorsuch As Circuit Ct Judge Including Schumer &amp; Obama https://t.co/zZ1gBmRcA0 #Gors…
‘Pokemon Go’: Evolution Items Now Guaranteed After Seven-Day PokeStop Streak https://t.co/8IjeqiP9Cq #election2016 https://t.co/pErSYQzvnm
Because she is a strong woman... and many men dismiss women. This was one of the most disturbing moments in the deb… https://t.co/0FcIr4W8Cm
Stay informed. Stay engaged. Speak up. Join the @OFA Truth Team: https://t.co/b0eae4PXDX
massive increases of ObamaCare will take place this year and Dems are to blame for the mess. It will fall of its own weight - be careful!
"Apple iPhone 7, 7 Plus get a red special-edition makeover - CNET https://t.co/WQ6YdVhmLG #election2016 https://t.co/xbFOMPxzQd"
RT @ErnestMoniz: THIS is what a #CleanEnergy revolution looks like. New report out today → https://t.co/o13p5fPNDg #ActOnClimate https://t.…
"RT @washingtonpost: As Ivanka Trump’s White House role expands, her company is sued for unfair competition https://t.co/YIUGqULCdp"
Great move on delay (by V. Putin) - I always knew he was very smart!
"LIVE: Trump says he had productive talks with Merkel, including on jobs and NATO funding. https://t.co/H9hBG83Y47"
RT @FSIStanford: FSI's @StonerWeiss discusses the FBI's investigation into Russian interference in #election2016. https://t.co/SRHfuZWeYP @…
"Trump budget plan to propose major cuts for State Dept., EPA: NY Times https://t.co/9R4rgcWo8U https://t.co/o4W3ZEyU0z"
RT @FSIStanford: FSI's @StonerWeiss discusses the FBI's investigation into Russian interference in #election2016. https://t.co/SRHfuZWeYP @…
"RT @Amy_Siskind: “There’s a smell of treason in the air,” presidential historian Douglas Brinkley said. https://t.co/JI01FR5Lbz"
"Intelligence agencies should never have allowed this fake news to ""leak"" into the public. One last shot at me.Are we living in Nazi Germany?"
LIVE: Republican House Intelligence Committee chairman says Comey among witnesses confirmed for March 20 hearing https://t.co/LtlFipdGcv
"We must keep ""evil"" out of our country!"
@SkyNews PROGRESS is a poison to the Labour Party.  3-400K new members joined Labour for A NEW KIND OF POLITICS.  JC4PM - back him or leave
BREAKING: Trump to nominate acting chairman of the Commodity Futures Trading Commission J. Christopher Giancarlo as chairman - White House
Looking forward to the Florida rally tomorrow. Big crowd expected!
"Trump budget aid for Israel, other countries being evaluated: State Dept. https://t.co/PYhyzXg1n0"
Tillerson says State Department spending 'simply not sustainable' https://t.co/KP50r6KbKG https://t.co/MUno3UE8pz
RT @FSIStanford: FSI's @StonerWeiss discusses the FBI's investigation into Russian interference in #election2016. https://t.co/SRHfuZWeYP @…
